Family,ID,Control Name,NIST Control Description
AUDIT AND ACCOUNTABILITY,AU-12,Audit Record Generation,"a. Provide audit record generation capability for the event types the system is capable of auditing as defined in AU-2a on [Assignment: organization-defined system components];
 b. Allow [Assignment: organization-defined personnel or roles] to select the event types that are to be logged by specific components of the system; and
 c. Generate audit records for the event types defined in AU-2c that include the audit record content defined in AU-3."
SECURITY ASSESSMENT AND AUTHORIZATION,CA-1,Policy and Procedures,"a. Develop, document, and disseminate to [Assignment: organization-defined personnel or roles]:
 1. [Selection (one or more): Organization-level; Mission/business process-level; System-level] assessment, authorization, and monitoring policy that:
 (a) Addresses purpose, scope, roles, responsibilities, management commitment, coordination among organizational entities, and compliance; and
 (b) Is consistent with applicable laws, executive orders, directives, regulations, policies, standards, and guidelines; and
 2. Procedures to facilitate the implementation of the assessment, authorization, and monitoring policy and the associated assessment, authorization, and monitoring controls;
 b. Designate an [Assignment: organization-defined official] to manage the development, documentation, and dissemination of the assessment, authorization, and monitoring policy and procedures; and
 c. Review and update the current assessment, authorization, and monitoring:
 1. Policy [Assignment: organization-defined frequency] and following [Assignment: organization-defined events]; and
 2. Procedures [Assignment: organization-defined frequency] and following [Assignment: organization-defined events]."
SECURITY ASSESSMENT AND AUTHORIZATION,CA-2,Control Assessments,"a. Select the appropriate assessor or assessment team for the type of assessment to be conducted;
 b. Develop a control assessment plan that describes the scope of the assessment including:
 1. Controls and control enhancements under assessment;
 2. Assessment procedures to be used to determine control effectiveness; and
 3. Assessment environment, assessment team, and assessment roles and responsibilities;
 c. Ensure the control assessment plan is reviewed and approved by the authorizing official or designated representative prior to conducting the assessment;
 d. Assess the controls in the system and its environment of operation [Assignment: organization-defined frequency] to determine the extent to which the controls are implemented correctly, operating as intended, and producing the desired outcome with respect to meeting established security and privacy requirements;
 e. Produce a control assessment report that document the results of the assessment; and
 f. Provide the results of the control assessment to [Assignment: organization-defined individuals or roles]."
SECURITY ASSESSMENT AND AUTHORIZATION,CA-2 (1),Control Assessments | Independent Assessors,Employ independent assessors or assessment teams to conduct control assessments.
SECURITY ASSESSMENT AND AUTHORIZATION,CA-2 (3),Control Assessments | Leveraging Results from External Organizations,Leverage the results of control assessments performed by [Assignment: organization-defined external organization] on [Assignment: organization-defined system] when the assessment meets [Assignment: organization-defined requirements].
SECURITY ASSESSMENT AND AUTHORIZATION,CA-3,Information Exchange,"a. Approve and manage the exchange of information between the system and other systems using [Selection (one or more): interconnection security agreements; information exchange security agreements; memoranda of understanding or agreement; service level agreements; user agreements; nondisclosure agreements; [Assignment: organization-defined type of agreement]];
 b. Document, as part of each exchange agreement, the interface characteristics, security and privacy requirements, controls, and responsibilities for each system, and the impact level of the information communicated; and
 c. Review and update the agreements [Assignment: organization-defined frequency]."
SECURITY ASSESSMENT AND AUTHORIZATION,CA-5,Plan of Action and Milestones,"a. Develop a plan of action and milestones for the system to document the planned remediation actions of the organization to correct weaknesses or deficiencies noted during the assessment of the controls and to reduce or eliminate known vulnerabilities in the system; and
 b. Update existing plan of action and milestones [Assignment: organization-defined frequency] based on the findings from control assessments, independent audits or reviews, and continuous monitoring activities."
SECURITY ASSESSMENT AND AUTHORIZATION,CA-6,Authorization,"a. Assign a senior official as the authorizing official for the system;
 b. Assign a senior official as the authorizing official for common controls available for inheritance by organizational systems;
 c. Ensure that the authorizing official for the system, before commencing operations:
 1. Accepts the use of common controls inherited by the system; and
 2. Authorizes the system to operate;
 d. Ensure that the authorizing official for common controls authorizes the use of those controls for inheritance by organizational systems;
 e. Update the authorizations [Assignment: organization-defined frequency]."
SECURITY ASSESSMENT AND AUTHORIZATION,CA-7,Continuous Monitoring,"Develop a system-level continuous monitoring strategy and implement continuous monitoring in accordance with the organization-level continuous monitoring strategy that includes:
 a. Establishing the following system-level metrics to be monitored: [Assignment: organization-defined system-level metrics];
 b. Establishing [Assignment: organization-defined frequencies] for monitoring and [Assignment: organization-defined frequencies] for assessment of control effectiveness;
 c. Ongoing control assessments in accordance with the continuous monitoring strategy;
 d. Ongoing monitoring of system and organization-defined metrics in accordance with the continuous monitoring strategy;
 e. Correlation and analysis of information generated by control assessments and monitoring;
 f. Response actions to address results of the analysis of control assessment and monitoring information; and
 g. Reporting the security and privacy status of the system to [Assignment: organization-defined personnel or roles] [Assignment: organization-defined frequency]."
SECURITY ASSESSMENT AND AUTHORIZATION,CA-7 (1),Continuous Monitoring | Independent Assessment,Employ independent assessors or assessment teams to monitor the controls in the system on an ongoing basis.
SECURITY ASSESSMENT AND AUTHORIZATION,CA-7 (4),Continuous Monitoring | Risk Monitoring,"Ensure risk monitoring is an integral part of the continuous monitoring strategy that includes the following:
 (a) Effectiveness monitoring;
 (b) Compliance monitoring; and
 (c) Change monitoring."
SECURITY ASSESSMENT AND AUTHORIZATION,CA-8,Penetration Testing,Conduct penetration testing [Assignment: organization-defined frequency] on [Assignment: organization-defined systems or system components].
SECURITY ASSESSMENT AND AUTHORIZATION,CA-8 (1),Penetration Testing | Independent Penetration Testing Agent or Team,Employ an independent penetration testing agent or team to perform penetration testing on the system or system components.
SECURITY ASSESSMENT AND AUTHORIZATION,CA-8 (2),Penetration Testing | Red Team Exercises,Employ the following red-team exercises to simulate attempts by adversaries to compromise organizational systems in accordance with applicable rules of engagement: [Assignment: organization-defined red team exercises].
SECURITY ASSESSMENT AND AUTHORIZATION,CA-9,Internal System Connections,"a. Authorize internal connections of [Assignment: organization-defined system components or classes of components] to the system;
 b. Document, for each internal connection, the interface characteristics, security and privacy requirements, and the nature of the information communicated;
 c. Terminate internal system connections after [Assignment: organization-defined conditions]; and
 d. Review [Assignment: organization-defined frequency] the continued need for each internal connection."
CONFIGURATION MANAGEMENT,CM-1,Policy and Procedures,"a. Develop, document, and disseminate to [Assignment: organization-defined personnel or roles]:
 1. [Selection (one or more): Organization-level; Mission/business process-level; System-level] configuration management policy that:
 (a) Addresses purpose, scope, roles, responsibilities, management commitment, coordination among organizational entities, and compliance; and
 (b) Is consistent with applicable laws, executive orders, directives, regulations, policies, standards, and guidelines; and
 2. Procedures to facilitate the implementation of the configuration management policy and the associated configuration management controls;
 b. Designate an [Assignment: organization-defined official] to manage the development, documentation, and dissemination of the configuration management policy and procedures; and
 c. Review and update the current configuration management:
 1. Policy [Assignment: organization-defined frequency] and following [Assignment: organization-defined events]; and
 2. Procedures [Assignment: organization-defined frequency] and following [Assignment: organization-defined events]."
CONFIGURATION MANAGEMENT,CM-2,Baseline Configuration,"a. Develop, document, and maintain under configuration control, a current baseline configuration of the system; and
 b. Review and update the baseline configuration of the system:
 1. [Assignment: organization-defined frequency];
 2. When required due to [Assignment: organization-defined circumstances]; and
 3. When system components are installed or upgraded."
CONFIGURATION MANAGEMENT,CM-2 (2),Baseline Configuration | Automation Support for Accuracy and Currency,"Maintain the currency, completeness, accuracy, and availability of the baseline configuration of the system using [Assignment: organization-defined automated mechanisms]."
CONFIGURATION MANAGEMENT,CM-2 (3),Baseline Configuration | Retention of Previous Configurations,Retain [Assignment: organization-defined number] of previous versions of baseline configurations of the system to support rollback.
CONFIGURATION MANAGEMENT,CM-2 (7),Baseline Configuration | Configure Systems and Components for High-risk Areas," (a) Issue [Assignment: organization-defined systems or system components] with [Assignment: organization-defined configurations] to individuals traveling to locations that the organization deems to be of significant risk; and
 (b) Apply the following controls to the systems or components when the individuals return from travel: [Assignment: organization-defined controls]."
CONFIGURATION MANAGEMENT,CM-3,Configuration Change Control,"a. Determine and document the types of changes to the system that are configuration-controlled;
 b. Review proposed configuration-controlled changes to the system and approve or disapprove such changes with explicit consideration for security and privacy impact analyses;
 c. Document configuration change decisions associated with the system;
 d. Implement approved configuration-controlled changes to the system;
 e. Retain records of configuration-controlled changes to the system for [Assignment: organization-defined time period];
 f. Monitor and review activities associated with configuration-controlled changes to the system; and
 g. Coordinate and provide oversight for configuration change control activities through [Assignment: organization-defined configuration change control element] that convenes [Selection (one or more): [Assignment: organization-defined frequency]; when [Assignment: organization-defined configuration change conditions]]."
CONFIGURATION MANAGEMENT,CM-3 (2),"Configuration Change Control | Testing, Validation, and Documentation of Changes","Test, validate, and document changes to the system before finalizing the implementation of the changes."
CONFIGURATION MANAGEMENT,CM-3 (4),Configuration Change Control | Security and Privacy Representatives,Require [Assignment: organization-defined security and privacy representatives] to be members of the [Assignment: organization-defined configuration change control element].
CONFIGURATION MANAGEMENT,CM-4,Impact Analyses,Analyze changes to the system to determine potential security and privacy impacts prior to change implementation.
CONFIGURATION MANAGEMENT,CM-4 (2),Impact Analyses | Verification of Controls,"After system changes, verify that the impacted controls are implemented correctly, operating as intended, and producing the desired outcome with regard to meeting the security and privacy requirements for the system."
CONFIGURATION MANAGEMENT,CM-5,Access Restrictions for Change,"Define, document, approve, and enforce physical and logical access restrictions associated with changes to the system."
CONFIGURATION MANAGEMENT,CM-5 (1),Access Restrictions for Change | Automated Access Enforcement and Audit Records," (a) Enforce access restrictions using [Assignment: organization-defined automated mechanisms]; and 
 (b) Automatically generate audit records of the enforcement actions."
CONFIGURATION MANAGEMENT,CM-5 (5),Access Restrictions for Change | Privilege Limitation for Production and Operation," (a) Limit privileges to change system components and system-related information within a production or operational environment; and
 (b) Review and reevaluate privileges [Assignment: organization-defined frequency]."
CONFIGURATION MANAGEMENT,CM-6,Configuration Settings,"a. Establish and document configuration settings for components employed within the system that reflect the most restrictive mode consistent with operational requirements using [Assignment: organization-defined common secure configurations];
 b. Implement the configuration settings;
 c. Identify, document, and approve any deviations from established configuration settings for [Assignment: organization-defined system components] based on [Assignment: organization-defined operational requirements]; and
 d. Monitor and control changes to the configuration settings in accordance with organizational policies and procedures."
CONFIGURATION MANAGEMENT,CM-6 (1),"Configuration Settings | Automated Management, Application, and Verification","Manage, apply, and verify configuration settings for [Assignment: organization-defined system components] using [Assignment: organization-defined automated mechanisms]."
CONFIGURATION MANAGEMENT,CM-7,Least Functionality,"a. Configure the system to provide only [Assignment: organization-defined mission essential capabilities]; and
 b. Prohibit or restrict the use of the following functions, ports, protocols, software, and/or services: [Assignment: organization-defined prohibited or restricted functions, system ports, protocols, software, and/or services]."
CONFIGURATION MANAGEMENT,CM-7 (1),Least Functionality | Periodic Review," (a) Review the system [Assignment: organization-defined frequency] to identify unnecessary and/or nonsecure functions, ports, protocols, software, and services; and
 (b) Disable or remove [Assignment: organization-defined functions, ports, protocols, software, and services within the system deemed to be unnecessary and/or nonsecure]."
CONFIGURATION MANAGEMENT,CM-7 (2),Least Functionality | Prevent Program Execution,"Prevent program execution in accordance with [Selection (one or more): [Assignment: organization-defined policies, rules of behavior, and/or access agreements regarding software program usage and restrictions]; rules authorizing the terms and conditions of software program usage]."
CONFIGURATION MANAGEMENT,CM-7 (5),Least Functionality | Authorized Software — Allow-by-exception," (a) Identify [Assignment: organization-defined software programs authorized to execute on the system];
 (b) Employ a deny-all, permit-by-exception policy to allow the execution of authorized software programs on the system; and
 (c) Review and update the list of authorized software programs [Assignment: organization-defined frequency]."
CONFIGURATION MANAGEMENT,CM-8,System Component Inventory,"a. Develop and document an inventory of system components that:
 1. Accurately reflects the system;
 2. Includes all components within the system;
 3. Does not include duplicate accounting of components or components assigned to any other system;
 4. Is at the level of granularity deemed necessary for tracking and reporting; and
 5. Includes the following information to achieve system component accountability: [Assignment: organization-defined information deemed necessary to achieve effective system component accountability]; and
 b. Review and update the system component inventory [Assignment: organization-defined frequency]."
CONFIGURATION MANAGEMENT,CM-8 (1),System Component Inventory | Updates During Installation and Removal,"Update the inventory of system components as part of component installations, removals, and system updates."
CONFIGURATION MANAGEMENT,CM-8 (3),System Component Inventory | Automated Unauthorized Component Detection," (a) Detect the presence of unauthorized hardware, software, and firmware components within the system using [Assignment: organization-defined automated mechanisms] [Assignment: organization-defined frequency]; and
 (b) Take the following actions when unauthorized components are detected: [Selection (one or more): disable network access by such components; isolate the components; notify [Assignment: organization-defined personnel or roles]]."
CONFIGURATION MANAGEMENT,CM-9,Configuration Management Plan,"Develop, document, and implement a configuration management plan for the system that:
 a. Addresses roles, responsibilities, and configuration management processes and procedures;
 b. Establishes a process for identifying configuration items throughout the system development life cycle and for managing the configuration of the configuration items;
 c. Defines the configuration items for the system and places the configuration items under configuration management;
 d. Is reviewed and approved by [Assignment: organization-defined personnel or roles]; and
 e. Protects the configuration management plan from unauthorized disclosure and modification."
CONFIGURATION MANAGEMENT,CM-10,Software Usage Restrictions,"a. Use software and associated documentation in accordance with contract agreements and copyright laws;
 b. Track the use of software and associated documentation protected by quantity licenses to control copying and distribution; and
 c. Control and document the use of peer-to-peer file sharing technology to ensure that this capability is not used for the unauthorized distribution, display, performance, or reproduction of copyrighted work."
CONFIGURATION MANAGEMENT,CM-11,User-installed Software,"a. Establish [Assignment: organization-defined policies] governing the installation of software by users;
 b. Enforce software installation policies through the following methods: [Assignment: organization-defined methods]; and
 c. Monitor policy compliance [Assignment: organization-defined frequency]."
CONFIGURATION MANAGEMENT,CM-12,Information Location,"a. Identify and document the location of [Assignment: organization-defined information] and the specific system components on which the information is processed and stored;
 b. Identify and document the users who have access to the system and system components where the information is processed and stored; and
 c. Document changes to the location (i.e., system or system components) where the information is processed and stored."
CONFIGURATION MANAGEMENT,CM-12 (1),Information Location | Automated Tools to Support Information Location,Use automated tools to identify [Assignment: organization-defined information by information type] on [Assignment: organization-defined system components] to ensure controls are in place to protect organizational information and individual privacy.
CONTINGENCY PLANNING,CP-1,Policy and Procedures,"a. Develop, document, and disseminate to [Assignment: organization-defined personnel or roles]:
 1. [Selection (one or more): Organization-level; Mission/business process-level; System-level] contingency planning policy that:
 (a) Addresses purpose, scope, roles, responsibilities, management commitment, coordination among organizational entities, and compliance; and
 (b) Is consistent with applicable laws, executive orders, directives, regulations, policies, standards, and guidelines; and
 2. Procedures to facilitate the implementation of the contingency planning policy and the associated contingency planning controls;
 b. Designate an [Assignment: organization-defined official] to manage the development, documentation, and dissemination of the contingency planning policy and procedures; and
 c. Review and update the current contingency planning:
 1. Policy [Assignment: organization-defined frequency] and following [Assignment: organization-defined events]; and
 2. Procedures [Assignment: organization-defined frequency] and following [Assignment: organization-defined events]."
CONTINGENCY PLANNING,CP-2,Contingency Plan,"a. Develop a contingency plan for the system that:
 1. Identifies essential mission and business functions and associated contingency requirements;
 2. Provides recovery objectives, restoration priorities, and metrics;
 3. Addresses contingency roles, responsibilities, assigned individuals with contact information;
 4. Addresses maintaining essential mission and business functions despite a system disruption, compromise, or failure; 
 5. Addresses eventual, full system restoration without deterioration of the controls originally planned and implemented;
 6. Addresses the sharing of contingency information; and
 7. Is reviewed and approved by [Assignment: organization-defined personnel or roles];
 b. Distribute copies of the contingency plan to [Assignment: organization-defined key contingency personnel (identified by name and/or by role) and organizational elements];
 c. Coordinate contingency planning activities with incident handling activities;
 d. Review the contingency plan for the system [Assignment: organization-defined frequency];
 e. Update the contingency plan to address changes to the organization, system, or environment of operation and problems encountered during contingency plan implementation, execution, or testing;
 f. Communicate contingency plan changes to [Assignment: organization-defined key contingency personnel (identified by name and/or by role) and organizational elements];
 g. Incorporate lessons learned from contingency plan testing, training, or actual contingency activities into contingency testing and training; and
 h. Protect the contingency plan from unauthorized disclosure and modification."
CONTINGENCY PLANNING,CP-2 (1),Contingency Plan | Coordinate with Related Plans,Coordinate contingency plan development with organizational elements responsible for related plans.
CONTINGENCY PLANNING,CP-2 (3),Contingency Plan | Resume Mission and Business Functions,Plan for the resumption of [Selection: all; essential] mission and business functions within [Assignment: organization-defined time period] of contingency plan activation.
CONTINGENCY PLANNING,CP-2 (8),Contingency Plan | Identify Critical Assets,Identify critical system assets supporting [Selection: all; essential] mission and business functions.
CONTINGENCY PLANNING,CP-3,Contingency Training,"a. Provide contingency training to system users consistent with assigned roles and responsibilities: 
 1. Within [Assignment: organization-defined time period] of assuming a contingency role or responsibility;
 2. When required by system changes; and
 3. [Assignment: organization-defined frequency] thereafter; and
 b. Review and update contingency training content [Assignment: organization-defined frequency] and following [Assignment: organization-defined events]."
CONTINGENCY PLANNING,CP-4,Contingency Plan Testing,"a. Test the contingency plan for the system [Assignment: organization-defined frequency] using the following tests to determine the effectiveness of the plan and the readiness to execute the plan: [Assignment: organization-defined tests].
 b. Review the contingency plan test results; and
 c. Initiate corrective actions, if needed."
CONTINGENCY PLANNING,CP-4 (1),Contingency Plan Testing | Coordinate with Related Plans,Coordinate contingency plan testing with organizational elements responsible for related plans.
CONTINGENCY PLANNING,CP-6,Alternate Storage Site,"a. Establish an alternate storage site, including necessary agreements to permit the storage and retrieval of system backup information; and
 b. Ensure that the alternate storage site provides controls equivalent to that of the primary site."
CONTINGENCY PLANNING,CP-6 (1),Alternate Storage Site | Separation from Primary Site,Identify an alternate storage site that is sufficiently separated from the primary storage site to reduce susceptibility to the same threats.
CONTINGENCY PLANNING,CP-6 (3),Alternate Storage Site | Accessibility,Identify potential accessibility problems to the alternate storage site in the event of an area-wide disruption or disaster and outline explicit mitigation actions.
