Family,ID,Control Name,NIST Control Description
ACCESS CONTROL,AC-1,Policy and Procedures,"a. Develop, document, and disseminate to [Assignment: organization-defined personnel or roles]:
 1. [Selection (one or more): Organization-level; Mission/business process-level; System-level] access control policy that:
 (a) Addresses purpose, scope, roles, responsibilities, management commitment, coordination among organizational entities, and compliance; and
 (b) Is consistent with applicable laws, executive orders, directives, regulations, policies, standards, and guidelines; and
 2. Procedures to facilitate the implementation of the access control policy and the associated access controls;
 b. Designate an [Assignment: organization-defined official] to manage the development, documentation, and dissemination of the access control policy and procedures; and
 c. Review and update the current access control:
 1. Policy [Assignment: organization-defined frequency] and following [Assignment: organization-defined events]; and
 2. Procedures [Assignment: organization-defined frequency] and following [Assignment: organization-defined events]."
ACCESS CONTROL,AC-2,Account Management,"a. Define and document the types of accounts allowed and specifically prohibited for use within the system;
 b. Assign account managers;
 c. Require [Assignment: organization-defined prerequisites and criteria] for group and role membership;
 d. Specify:
 1. Authorized users of the system;
 2. Group and role membership; and
 3. Access authorizations (i.e., privileges) and [Assignment: organization-defined attributes (as required)] for each account;
 e. Require approvals by [Assignment: organization-defined personnel or roles] for requests to create accounts;
 f. Create, enable, modify, disable, and remove accounts in accordance with [Assignment: organization-defined policy, procedures, prerequisites, and criteria];
 g. Monitor the use of accounts;
 h. Notify account managers and [Assignment: organization-defined personnel or roles] within:
 1. [Assignment: organization-defined time period] when accounts are no longer required;
 2. [Assignment: organization-defined time period] when users are terminated or transferred; and
 3. [Assignment: organization-defined time period] when system usage or need-to-know changes for an individual;
 i. Authorize access to the system based on:
 1. A valid access authorization;
 2. Intended system usage; and
 3. [Assignment: organization-defined attributes (as required)];
 j. Review accounts for compliance with account management requirements [Assignment: organization-defined frequency];
 k. Establish and implement a process for changing shared or group account authenticators (if deployed) when individuals are removed from the group; and
 l. Align account management processes with personnel termination and transfer processes."
ACCESS CONTROL,AC-2 (1),Account Management | Automated System Account Management,Support the management of system accounts using [Assignment: organization-defined automated mechanisms].
ACCESS CONTROL,AC-2 (2),Account Management | Automated Temporary and Emergency Account Management,Automatically [Selection: remove; disable] temporary and emergency accounts after [Assignment: organization-defined time period for each type of account].
ACCESS CONTROL,AC-2 (3),Account Management | Disable Accounts,"Disable accounts within [Assignment: organization-defined time period] when the accounts: 
 (a) Have expired;
 (b) Are no longer associated with a user or individual;
 (c) Are in violation of organizational policy; or
 (d) Have been inactive for [Assignment: organization-defined time period]."
ACCESS CONTROL,AC-2 (4),Account Management | Automated Audit Actions,"Automatically audit account creation, modification, enabling, disabling, and removal actions."
ACCESS CONTROL,AC-2 (5),Account Management | Inactivity Logout,Require that users log out when [Assignment: organization-defined time period of expected inactivity or description of when to log out].
ACCESS CONTROL,AC-2 (7),Account Management | Privileged User Accounts," (a) Establish and administer privileged user accounts in accordance with [Selection: a role-based access scheme; an attribute-based access scheme];
 (b) Monitor privileged role or attribute assignments;
 (c) Monitor changes to roles or attributes; and
 (d) Revoke access when privileged role or attribute assignments are no longer appropriate."
ACCESS CONTROL,AC-2 (9),Account Management | Restrictions on Use of Shared and Group Accounts,Only permit the use of shared and group accounts that meet [Assignment: organization-defined conditions for establishing shared and group accounts].
ACCESS CONTROL,AC-2 (12),Account Management | Account Monitoring for Atypical Usage," (a) Monitor system accounts for [Assignment: organization-defined atypical usage]; and
 (b) Report atypical usage of system accounts to [Assignment: organization-defined personnel or roles]."
ACCESS CONTROL,AC-2 (13),Account Management | Disable Accounts for High-risk Individuals,Disable accounts of individuals within [Assignment: organization-defined time period] of discovery of [Assignment: organization-defined significant risks].
ACCESS CONTROL,AC-3,Access Enforcement,Enforce approved authorizations for logical access to information and system resources in accordance with applicable access control policies.
ACCESS CONTROL,AC-4,Information Flow Enforcement,Enforce approved authorizations for controlling the flow of information within the system and between connected systems based on [Assignment: organization-defined information flow control policies].
ACCESS CONTROL,AC-4 (21),Information Flow Enforcement | Physical or Logical Separation of Information Flows,Separate information flows logically or physically using [Assignment: organization-defined mechanisms and/or techniques] to accomplish [Assignment: organization-defined required separations by types of information].
ACCESS CONTROL,AC-5,Separation of Duties,"a. Identify and document [Assignment: organization-defined duties of individuals requiring separation]; and
 b. Define system access authorizations to support separation of duties."
ACCESS CONTROL,AC-6,Least Privilege,"Employ the principle of least privilege, allowing only authorized accesses for users (or processes acting on behalf of users) that are necessary to accomplish assigned organizational tasks."
ACCESS CONTROL,AC-6 (1),Least Privilege | Authorize Access to Security Functions,"Authorize access for [Assignment: organization-defined individuals or roles] to:
 (a) [Assignment: organization-defined security functions (deployed in hardware, software, and firmware)]; and
 (b) [Assignment: organization-defined security-relevant information]."
ACCESS CONTROL,AC-6 (2),Least Privilege | Non-privileged Access for Nonsecurity Functions,"Require that users of system accounts (or roles) with access to [Assignment: organization-defined security functions or security-relevant information] use non-privileged accounts or roles, when accessing nonsecurity functions."
ACCESS CONTROL,AC-6 (5),Least Privilege | Privileged Accounts,Restrict privileged accounts on the system to [Assignment: organization-defined personnel or roles].
ACCESS CONTROL,AC-6 (7),Least Privilege | Review of User Privileges," (a) Review [Assignment: organization-defined frequency] the privileges assigned to [Assignment: organization-defined roles or classes of users] to validate the need for such privileges; and
 (b) Reassign or remove privileges, if necessary, to correctly reflect organizational mission and business needs."
ACCESS CONTROL,AC-6 (9),Least Privilege | Log Use of Privileged Functions,Log the execution of privileged functions.
ACCESS CONTROL,AC-6 (10),Least Privilege | Prohibit Non-privileged Users from Executing Privileged Functions,Prevent non-privileged users from executing privileged functions.
ACCESS CONTROL,AC-7,Unsuccessful Logon Attempts,"a. Enforce a limit of [Assignment: organization-defined number] consecutive invalid logon attempts by a user during a [Assignment: organization-defined time period]; and
 b. Automatically [Selection (one or more): lock the account or node for an [Assignment: organization-defined time period]; lock the account or node until released by an administrator; delay next logon prompt per [Assignment: organization-defined delay algorithm]; notify system administrator; take other [Assignment: organization-defined action]] when the maximum number of unsuccessful attempts is exceeded."
ACCESS CONTROL,AC-8,System Use Notification,"a. Display [Assignment: organization-defined system use notification message or banner] to users before granting access to the system that provides privacy and security notices consistent with applicable laws, executive orders, directives, regulations, policies, standards, and guidelines and state that:
 1. Users are accessing a U.S. Government system;
 2. System usage may be monitored, recorded, and subject to audit;
 3. Unauthorized use of the system is prohibited and subject to criminal and civil penalties; and
 4. Use of the system indicates consent to monitoring and recording;
 b. Retain the notification message or banner on the screen until users acknowledge the usage conditions and take explicit actions to log on to or further access the system; and
 c. For publicly accessible systems:
 1. Display system use information [Assignment: organization-defined conditions], before granting further access to the publicly accessible system;
 2. Display references, if any, to monitoring, recording, or auditing that are consistent with privacy accommodations for such systems that generally prohibit those activities; and
 3. Include a description of the authorized uses of the system."
ACCESS CONTROL,AC-11,Device Lock,"a. Prevent further access to the system by [Selection (one or more): initiating a device lock after [Assignment: organization-defined time period] of inactivity; requiring the user to initiate a device lock before leaving the system unattended]; and
 b. Retain the device lock until the user reestablishes access using established identification and authentication procedures."
ACCESS CONTROL,AC-11 (1),Device Lock | Pattern-hiding Displays,"Conceal, via the device lock, information previously visible on the display with a publicly viewable image."
ACCESS CONTROL,AC-12,Session Termination,Automatically terminate a user session after [Assignment: organization-defined conditions or trigger events requiring session disconnect].
ACCESS CONTROL,AC-14,Permitted Actions Without Identification or Authentication,"a. Identify [Assignment: organization-defined user actions] that can be performed on the system without identification or authentication consistent with organizational mission and business functions; and
 b. Document and provide supporting rationale in the security plan for the system, user actions not requiring identification or authentication."
ACCESS CONTROL,AC-17,Remote Access,"a. Establish and document usage restrictions, configuration/connection requirements, and implementation guidance for each type of remote access allowed; and
 b. Authorize each type of remote access to the system prior to allowing such connections."
ACCESS CONTROL,AC-17 (1),Remote Access | Monitoring and Control,Employ automated mechanisms to monitor and control remote access methods.
ACCESS CONTROL,AC-17 (2),Remote Access | Protection of Confidentiality and Integrity Using Encryption,Implement cryptographic mechanisms to protect the confidentiality and integrity of remote access sessions.
ACCESS CONTROL,AC-17 (3),Remote Access | Managed Access Control Points,Route remote accesses through authorized and managed network access control points.
ACCESS CONTROL,AC-17 (4),Remote Access | Privileged Commands and Access," (a) Authorize the execution of privileged commands and access to security-relevant information via remote access only in a format that provides assessable evidence and for the following needs: [Assignment: organization-defined needs]; and
 (b) Document the rationale for remote access in the security plan for the system."
ACCESS CONTROL,AC-18,Wireless Access,"a. Establish configuration requirements, connection requirements, and implementation guidance for each type of wireless access; and
 b. Authorize each type of wireless access to the system prior to allowing such connections."
ACCESS CONTROL,AC-18 (1),Wireless Access | Authentication and Encryption,Protect wireless access to the system using authentication of [Selection (one or more): users; devices] and encryption.
ACCESS CONTROL,AC-18 (3),Wireless Access | Disable Wireless Networking,"Disable, when not intended for use, wireless networking capabilities embedded within system components prior to issuance and deployment."
ACCESS CONTROL,AC-19,Access Control for Mobile Devices,"a. Establish configuration requirements, connection requirements, and implementation guidance for organization-controlled mobile devices, to include when such devices are outside of controlled areas; and
 b. Authorize the connection of mobile devices to organizational systems."
ACCESS CONTROL,AC-19 (5),Access Control for Mobile Devices | Full Device or Container-based Encryption,Employ [Selection: full-device encryption; container-based encryption] to protect the confidentiality and integrity of information on [Assignment: organization-defined mobile devices].
ACCESS CONTROL,AC-20,Use of External Systems,"a. [Selection (one or more): Establish [Assignment: organization-defined terms and conditions]; Identify [Assignment: organization-defined controls asserted to be implemented on external systems]], consistent with the trust relationships established with other organizations owning, operating, and/or maintaining external systems, allowing authorized individuals to:
 1. Access the system from external systems; and
 2. Process, store, or transmit organization-controlled information using external systems; or
 b. Prohibit the use of [Assignment: organizationally-defined types of external systems]."
ACCESS CONTROL,AC-20 (1),Use of External Systems | Limits on Authorized Use,"Permit authorized individuals to use an external system to access the system or to process, store, or transmit organization-controlled information only after:
 (a) Verification of the implementation of controls on the external system as specified in the organization’s security and privacy policies and security and privacy plans; or
 (b) Retention of approved system connection or processing agreements with the organizational entity hosting the external system."
ACCESS CONTROL,AC-20 (2),Use of External Systems | Portable Storage Devices — Restricted Use,Restrict the use of organization-controlled portable storage devices by authorized individuals on external systems using [Assignment: organization-defined restrictions].
ACCESS CONTROL,AC-21,Information Sharing,"a. Enable authorized users to determine whether access authorizations assigned to a sharing partner match the information’s access and use restrictions for [Assignment: organization-defined information sharing circumstances where user discretion is required]; and
 b. Employ [Assignment: organization-defined automated mechanisms or manual processes] to assist users in making information sharing and collaboration decisions."
ACCESS CONTROL,AC-22,Publicly Accessible Content,"a. Designate individuals authorized to make information publicly accessible;
 b. Train authorized individuals to ensure that publicly accessible information does not contain nonpublic information;
 c. Review the proposed content of information prior to posting onto the publicly accessible system to ensure that nonpublic information is not included; and
 d. Review the content on the publicly accessible system for nonpublic information [Assignment: organization-defined frequency] and remove such information, if discovered."
AWARENESS AND TRAINING,AT-1,Policy and Procedures,"a. Develop, document, and disseminate to [Assignment: organization-defined personnel or roles]:
 1. [Selection (one or more): Organization-level; Mission/business process-level; System-level] awareness and training policy that:
 (a) Addresses purpose, scope, roles, responsibilities, management commitment, coordination among organizational entities, and compliance; and
 (b) Is consistent with applicable laws, executive orders, directives, regulations, policies, standards, and guidelines; and
 2. Procedures to facilitate the implementation of the awareness and training policy and the associated awareness and training controls;
 b. Designate an [Assignment: organization-defined official] to manage the development, documentation, and dissemination of the awareness and training policy and procedures; and
 c. Review and update the current awareness and training:
 1. Policy [Assignment: organization-defined frequency] and following [Assignment: organization-defined events]; and
 2. Procedures [Assignment: organization-defined frequency] and following [Assignment: organization-defined events]."
AWARENESS AND TRAINING,AT-2,Literacy Training and Awareness,"a. Provide security and privacy literacy training to system users (including managers, senior executives, and contractors):
 1. As part of initial training for new users and [Assignment: organization-defined frequency] thereafter; and
 2. When required by system changes or following [Assignment: organization-defined events];
 b. Employ the following techniques to increase the security and privacy awareness of system users [Assignment: organization-defined awareness techniques];
 c. Update literacy training and awareness content [Assignment: organization-defined frequency] and following [Assignment: organization-defined events]; and
 d. Incorporate lessons learned from internal or external security incidents or breaches into literacy training and awareness techniques."
AWARENESS AND TRAINING,AT-2 (2),Literacy Training and Awareness | Insider Threat,Provide literacy training on recognizing and reporting potential indicators of insider threat.
AWARENESS AND TRAINING,AT-2 (3),Literacy Training and Awareness | Social Engineering and Mining,Provide literacy training on recognizing and reporting potential and actual instances of social engineering and social mining.
AWARENESS AND TRAINING,AT-3,Role-based Training,"a. Provide role-based security and privacy training to personnel with the following roles and responsibilities: [Assignment: organization-defined roles and responsibilities]:
 1. Before authorizing access to the system, information, or performing assigned duties, and [Assignment: organization-defined frequency] thereafter; and
 2. When required by system changes;
 b. Update role-based training content [Assignment: organization-defined frequency] and following [Assignment: organization-defined events]; and
 c. Incorporate lessons learned from internal or external security incidents or breaches into role-based training."
AWARENESS AND TRAINING,AT-4,Training Records,"a. Document and monitor information security and privacy training activities, including security and privacy awareness training and specific role-based security and privacy training; and
 b. Retain individual training records for [Assignment: organization-defined time period]."
AUDIT AND ACCOUNTABILITY,AU-1,Policy and Procedures,"a. Develop, document, and disseminate to [Assignment: organization-defined personnel or roles]:
 1. [Selection (one or more): Organization-level; Mission/business process-level; System-level] audit and accountability policy that:
 (a) Addresses purpose, scope, roles, responsibilities, management commitment, coordination among organizational entities, and compliance; and
 (b) Is consistent with applicable laws, executive orders, directives, regulations, policies, standards, and guidelines; and
 2. Procedures to facilitate the implementation of the audit and accountability policy and the associated audit and accountability controls;
 b. Designate an [Assignment: organization-defined official] to manage the development, documentation, and dissemination of the audit and accountability policy and procedures; and
 c. Review and update the current audit and accountability:
 1. Policy [Assignment: organization-defined frequency] and following [Assignment: organization-defined events]; and
 2. Procedures [Assignment: organization-defined frequency] and following [Assignment: organization-defined events]."
AUDIT AND ACCOUNTABILITY,AU-2,Event Logging,"a. Identify the types of events that the system is capable of logging in support of the audit function: [Assignment: organization-defined event types that the system is capable of logging];
 b. Coordinate the event logging function with other organizational entities requiring audit-related information to guide and inform the selection criteria for events to be logged;
 c. Specify the following event types for logging within the system: [Assignment: organization-defined event types (subset of the event types defined in AU-2a.) along with the frequency of (or situation requiring) logging for each identified event type];
 d. Provide a rationale for why the event types selected for logging are deemed to be adequate to support after-the-fact investigations of incidents; and
 e. Review and update the event types selected for logging [Assignment: organization-defined frequency]."
AUDIT AND ACCOUNTABILITY,AU-3,Content of Audit Records,"Ensure that audit records contain information that establishes the following:
 a. What type of event occurred;
 b. When the event occurred;
 c. Where the event occurred;
 d. Source of the event;
 e. Outcome of the event; and 
 f. Identity of any individuals, subjects, or objects/entities associated with the event."
AUDIT AND ACCOUNTABILITY,AU-3 (1),Content of Audit Records | Additional Audit Information,Generate audit records containing the following additional information: [Assignment: organization-defined additional information].
AUDIT AND ACCOUNTABILITY,AU-4,Audit Log Storage Capacity,Allocate audit log storage capacity to accommodate [Assignment: organization-defined audit log retention requirements].
AUDIT AND ACCOUNTABILITY,AU-5,Response to Audit Logging Process Failures,"a. Alert [Assignment: organization-defined personnel or roles] within [Assignment: organization-defined time period] in the event of an audit logging process failure; and
 b. Take the following additional actions: [Assignment: organization-defined additional actions]."
AUDIT AND ACCOUNTABILITY,AU-6,"Audit Record Review, Analysis, and Reporting","a. Review and analyze system audit records [Assignment: organization-defined frequency] for indications of [Assignment: organization-defined inappropriate or unusual activity] and the potential impact of the inappropriate or unusual activity;
 b. Report findings to [Assignment: organization-defined personnel or roles]; and
 c. Adjust the level of audit record review, analysis, and reporting within the system when there is a change in risk based on law enforcement information, intelligence information, or other credible sources of information."
AUDIT AND ACCOUNTABILITY,AU-6 (1),"Audit Record Review, Analysis, and Reporting | Automated Process Integration","Integrate audit record review, analysis, and reporting processes using [Assignment: organization-defined automated mechanisms]."
AUDIT AND ACCOUNTABILITY,AU-6 (3),"Audit Record Review, Analysis, and Reporting | Correlate Audit Record Repositories",Analyze and correlate audit records across different repositories to gain organization-wide situational awareness.
AUDIT AND ACCOUNTABILITY,AU-7,Audit Record Reduction and Report Generation,"Provide and implement an audit record reduction and report generation capability that:
 a. Supports on-demand audit record review, analysis, and reporting requirements and after-the-fact investigations of incidents; and
 b. Does not alter the original content or time ordering of audit records."
AUDIT AND ACCOUNTABILITY,AU-7 (1),Audit Record Reduction and Report Generation | Automatic Processing,"Provide and implement the capability to process, sort, and search audit records for events of interest based on the following content: [Assignment: organization-defined fields within audit records]."
AUDIT AND ACCOUNTABILITY,AU-8,Time Stamps,"a. Use internal system clocks to generate time stamps for audit records; and
 b. Record time stamps for audit records that meet [Assignment: organization-defined granularity of time measurement] and that use Coordinated Universal Time, have a fixed local time offset from Coordinated Universal Time, or that include the local time offset as part of the time stamp."
AUDIT AND ACCOUNTABILITY,AU-9,Protection of Audit Information,"a. Protect audit information and audit logging tools from unauthorized access, modification, and deletion; and
 b. Alert [Assignment: organization-defined personnel or roles] upon detection of unauthorized access, modification, or deletion of audit information."
AUDIT AND ACCOUNTABILITY,AU-9 (4),Protection of Audit Information | Access by Subset of Privileged Users,Authorize access to management of audit logging functionality to only [Assignment: organization-defined subset of privileged users or roles].
AUDIT AND ACCOUNTABILITY,AU-11,Audit Record Retention,Retain audit records for [Assignment: organization-defined time period consistent with records retention policy] to provide support for after-the-fact investigations of incidents and to meet regulatory and organizational information retention requirements.
